{
  "@context": {
    "odrl": "http://www.w3.org/ns/odrl/2/",
    "cdifa1": "https://w3id.org/cdif/access/profile1/",
    "rdf": "http://www.w3.org/1999/02/22-rdf-syntax-ns#",
    "xsd": "http://www.w3.org/2001/XMLSchema#"
  },
  "@type": [
    "odrl:Offer"
  ],
  "@id": "https://example.org/odrloffer/13adb49c-f641-4ac7-aa90-18651cc211ce",
  "odrl:profile": {
    "@id": "https://w3id.org/cdif/access/profile1/cdifa1.ttl"
  },
  "odrl:assigner": {
    "@id": "https://example.org/repository"
  },
  "odrl:permission": [
    {
      "odrl:target": {
        "@id": "https://example.org/dataset/3936/distribution/csv"
      },
      "odrl:action": {
        "@id": "cdifa1:download"
      },
      "odrl:constraint": [
        {
          "@type": [
            "odrl:Constraint"
          ],
          "odrl:leftOperand": {
            "@id": "odrl:spatial"
          },
          "odrl:operator": {
            "@id": "odrl:eq"
          },
          "odrl:rightOperand": {
            "@id": "http://publications.europa.eu/resource/authority/country/GBR"
          }
        }
      ],
      "odrl:duty": [
        {
          "odrl:action": {
            "@id": "cdifa1:assent"
          },
          "odrl:constraint": [
            {
              "odrl:leftOperand": {
                "@id": "odrl:event"
              },
              "odrl:operator": {
                "@id": "odrl:lt"
              },
              "odrl:rightOperand": {
                "@id": "odrl:policyUsage"
              }
            }
          ]
        }
      ]
    },
    {
      "odrl:target": {
        "@id": "https://example.org/dataset/3936/distribution/csv"
      },
      "odrl:action": {
        "@id": "odrl:use"
      },
      "odrl:assignee": {
        "@type": [
          "odrl:PartyCollection"
        ],
        "odrl:source": {
          "@id": "https://example.org/partycollection/registered-users"
        },
        "odrl:refinement": [
          {
            "@type": [
              "odrl:Constraint"
            ],
            "odrl:leftOperand": {
              "@id": "odrl:spatial"
            },
            "odrl:operator": {
              "@id": "odrl:eq"
            },
            "odrl:rightOperand": {
              "@id": "http://publications.europa.eu/resource/authority/country/GBR"
            }
          }
        ]
      }
    }
  ],
  "odrl:obligation": [
    {
      "odrl:target": {
        "@id": "https://example.org/dataset/3936/distribution/csv"
      },
      "odrl:action": {
        "rdf:value": {
          "@id": "cdifa1:datadestruction"
        },
        "odrl:refinement": [
          {
            "@type": [
              "odrl:Constraint"
            ],
            "odrl:leftOperand": {
              "@id": "odrl:dateTime"
            },
            "odrl:operator": {
              "@id": "odrl:lteq"
            },
            "odrl:rightOperand": {
              "@value": "2027-12-31",
              "@type": "xsd:date"
            }
          }
        ]
      }
    }
  ],
  "odrl:prohibition": [
    {
      "odrl:target": {
        "@id": "https://example.org/dataset/3936/distribution/csv"
      },
      "odrl:action": {
        "@id": "cdifa1:shareTRECredentials"
      }
    }
  ]
}
